{
  "scene": "benchmark_forest",
  "device": "Quest 2",
  "refresh_rate_hz": 120,
  "duration_minutes": 30,
  "cpu_ms": {
    "p50": 5.4,
    "p95": 6.3,
    "p99": 7.6
  },
  "gpu_ms": {
    "p50": 5.8,
    "p95": 6.6,
    "p99": 7.9
  },
  "draw_calls_p95": 71,
  "visible_triangles_p95": 146000,
  "dropped_frames": 0,
  "notes": "Valores de ejemplo; reemplazar con medición real."
}
